{
  "$schema": "https://json-schema.org/draft/2020-12/schema",
  "$id": "https://jarenjs.dev/schemas/jaren-workflow/0.2/authoring",
  "title": "Jaren composed workflow 0.2 (authoring profile)",
  "description": "Authoring profile of the canonical grammar: the document SHAPE only, with queryDocument, dagDocument left open. Constrains decoding on small models, where the full grammar does not decode at all. It is deliberately WEAKER than the canonical schema - a document valid here may be nonsense - so the engine compiler is the gate that makes it safe, and generated documents must be compiled before use.",
  "type": "object",
  "properties": {
    "$workflow": {
      "const": "0.2"
    },
    "revision": {
      "type": "string",
      "minLength": 1
    },
    "initial": {
      "type": "string",
      "minLength": 1
    },
    "states": {
      "type": "object",
      "minProperties": 1,
      "additionalProperties": {
        "$ref": "#/$defs/state"
      },
      "description": "(LLM profile: a member-name constraint is relaxed here; the canonical schema enforces it)"
    }
  },
  "required": [
    "$workflow",
    "revision",
    "initial",
    "states"
  ],
  "additionalProperties": false,
  "$defs": {
    "queryDocument": {
      "description": "A Jaren query expression; validate against the full grammar and compile locally."
    },
    "dagDocument": {
      "description": "A Jaren DAG document; validate and compile with versioned tasks locally."
    },
    "body": {
      "type": "object",
      "properties": {
        "initial": {
          "type": "string",
          "minLength": 1
        },
        "states": {
          "type": "object",
          "minProperties": 1,
          "additionalProperties": {
            "$ref": "#/$defs/state"
          },
          "description": "(LLM profile: a member-name constraint is relaxed here; the canonical schema enforces it)"
        }
      },
      "required": [
        "initial",
        "states"
      ],
      "additionalProperties": false
    },
    "state": {
      "anyOf": [
        {
          "type": "object",
          "properties": {
            "work": {
              "anyOf": [
                {
                  "type": "object",
                  "properties": {
                    "task": {
                      "type": "string",
                      "minLength": 1
                    },
                    "version": {
                      "type": "string",
                      "minLength": 1
                    },
                    "with": {
                      "$ref": "#/$defs/queryDocument"
                    }
                  },
                  "required": [
                    "task",
                    "version"
                  ],
                  "additionalProperties": false
                },
                {
                  "type": "object",
                  "properties": {
                    "dag": {
                      "$ref": "#/$defs/dagDocument"
                    }
                  },
                  "required": [
                    "dag"
                  ],
                  "additionalProperties": false
                }
              ]
            },
            "input": {
              "$ref": "#/$defs/queryDocument"
            },
            "then": {
              "type": "string",
              "minLength": 1
            },
            "catch": {
              "type": "string",
              "minLength": 1
            },
            "limit": {
              "type": "integer",
              "minimum": 1,
              "maximum": 9007199254740991
            }
          },
          "required": [
            "work",
            "then"
          ],
          "additionalProperties": false
        },
        {
          "type": "object",
          "properties": {
            "choose": {
              "type": "array",
              "items": {
                "type": "object",
                "properties": {
                  "guard": {
                    "$ref": "#/$defs/queryDocument"
                  },
                  "to": {
                    "type": "string",
                    "minLength": 1
                  }
                },
                "required": [
                  "guard",
                  "to"
                ],
                "additionalProperties": false
              },
              "minItems": 1
            },
            "otherwise": {
              "type": "string",
              "minLength": 1
            },
            "limit": {
              "type": "integer",
              "minimum": 1,
              "maximum": 9007199254740991
            }
          },
          "required": [
            "choose",
            "otherwise"
          ],
          "additionalProperties": false
        },
        {
          "type": "object",
          "properties": {
            "on": {
              "type": "array",
              "items": {
                "type": "object",
                "properties": {
                  "event": {
                    "type": "string",
                    "minLength": 1
                  },
                  "to": {
                    "type": "string",
                    "minLength": 1
                  },
                  "guard": {
                    "$ref": "#/$defs/queryDocument"
                  }
                },
                "required": [
                  "event",
                  "to"
                ],
                "additionalProperties": false
              },
              "minItems": 0
            },
            "after": {
              "type": "object",
              "properties": {
                "ms": {
                  "type": "number",
                  "minimum": 0
                },
                "to": {
                  "type": "string",
                  "minLength": 1
                }
              },
              "required": [
                "ms",
                "to"
              ],
              "additionalProperties": false
            },
            "limit": {
              "type": "integer",
              "minimum": 1,
              "maximum": 9007199254740991
            }
          },
          "required": [
            "on"
          ],
          "additionalProperties": false,
          "anyOf": [
            {
              "properties": {
                "on": {
                  "minItems": 1
                }
              }
            },
            {
              "required": [
                "after"
              ]
            }
          ]
        },
        {
          "type": "object",
          "properties": {
            "flow": {
              "$ref": "#/$defs/body"
            },
            "then": {
              "type": "string",
              "minLength": 1
            },
            "limit": {
              "type": "integer",
              "minimum": 1,
              "maximum": 9007199254740991
            }
          },
          "required": [
            "flow",
            "then"
          ],
          "additionalProperties": false
        },
        {
          "type": "object",
          "properties": {
            "final": {
              "const": true
            },
            "limit": {
              "type": "integer",
              "minimum": 1,
              "maximum": 9007199254740991
            }
          },
          "required": [
            "final"
          ],
          "additionalProperties": false
        }
      ]
    }
  }
}
